http://t.co/Hm20Klm7oQ,3.82E+17,Mrs C is getting tea ahead of tonight 's auditions @MitrePlayers http://t.co/Hm20Klm7oQ
http://t.co/jYm1lJHxU8,3.81E+17,magic music...always get goosebumps from his voice #beautifulben http://t.co/jYm1lJHxU8 @YouTube @benhowardmusic ??
http://t.co/SQ1xOXCrsM #Essex,3.81E+17,Travellers leave Chingford site http://t.co/SQ1xOXCrsM #Essex
http://broken.url/xyz,3.82E+17,Testing a broken url
http://t.co/aEmQoAXgA1,3.82E+17,@Toshi_0003 thanks for following me. Check out my song  star  video on YouTube:http://t.co/aEmQoAXgA1Let me know what you think?Bee
http://t.co/gYbpsOQC7y,3.82E+17,A sneaky peak into rehearsal for #ChickenShopPlay @WAPtheatre  @MarnieNash #UnderReading for @Jesse_AFC @lucyroslyn http://t.co/gYbpsOQC7y
"totally , wrong",,
http://t.co/gYbpsOQC7y,3.82E+17,A sneaky peak into rehearsal for #ChickenShopPlay @WAPtheatre  @MarnieNash #UnderReading for @Jesse_AFC @lucyroslyn http://t.co/gYbpsOQC7y